{
  "schema_version": 2,
  "case_id": "first-finished-contribution-primary",
  "route": {
    "selected_task": "contribute",
    "offline_contribution_access": "not_required",
    "live_campaign_authorization": "explicit_user_authorization_required",
    "authoritative_sources": [
      "README.md",
      "AGENTS.md",
      "docs/agents/first-contribution.md"
    ]
  },
  "contribution": {
    "kind": "documentation_correction",
    "changed_paths": ["docs/agents/quickstart.md"]
  },
  "validation": {
    "baseline": {
      "command": "python .github/scripts/validate_agent_docs.py truthfulness",
      "modes": ["truthfulness"],
      "exit_code": 1,
      "result": "failed"
    },
    "final": {
      "command": "python .github/scripts/validate_agent_docs.py all",
      "modes": ["all"],
      "exit_code": 0,
      "result": "passed"
    }
  },
  "human_review": {
    "summary": "Updated the quickstart registration example to pass invite_code=\"<CODE>\" and removed the stale fixture comment.",
    "rationale": "The authentication guide and the quickstart explanation require an invite code for first registration in an explicitly authorized live campaign. The corrected example matches that documented requirement. Truthfulness failed before the edit and passed afterward; links passed before and afterward. git diff --check exited successfully, but the snapshot files were initially untracked, so that command does not establish a tracked documentation diff."
  }
}
