{
  "schema_version": 2,
  "case_id": "first-finished-contribution-primary",
  "route": {
    "selected_task": "contribute",
    "offline_contribution_access": "not_required",
    "live_campaign_authorization": "explicit_user_authorization_required",
    "authoritative_sources": [
      "README.md",
      "AGENTS.md",
      "docs/agents/first-contribution.md"
    ]
  },
  "contribution": {
    "kind": "documentation_correction",
    "changed_paths": ["docs/agents/quickstart.md"]
  },
  "validation": {
    "baseline": {
      "command": "python .github/scripts/validate_agent_docs.py truthfulness links --root .",
      "modes": ["truthfulness", "links"],
      "exit_code": 1,
      "result": "failed"
    },
    "final": {
      "command": "python .github/scripts/validate_agent_docs.py truthfulness links --root .",
      "modes": ["truthfulness", "links"],
      "exit_code": 0,
      "result": "passed"
    }
  },
  "human_review": {
    "summary": "Corrected the quickstart registration example to pass an explicit invite-code placeholder.",
    "rationale": "The baseline validator rejected the bare registration call as a stale default. The corrected example matches the README's first-registration contract and the quickstart's existing explanation."
  }
}
