{
  "schema_version": 2,
  "case_id": "first-finished-contribution-primary",
  "route": {
    "selected_task": "contribute",
    "offline_contribution_access": "not_required",
    "live_campaign_authorization": "explicit_user_authorization_required",
    "authoritative_sources": [
      "README.md",
      "AGENTS.md",
      "docs/agents/start-here.md",
      "docs/agents/first-contribution.md"
    ]
  },
  "contribution": {
    "kind": "documentation_correction",
    "changed_paths": [
      "docs/agents/quickstart.md"
    ]
  },
  "validation": {
    "baseline": {
      "command": "python .github/scripts/validate_agent_docs.py truthfulness links --root .",
      "modes": [
        "truthfulness",
        "links"
      ],
      "exit_code": 1,
      "result": "failed"
    },
    "final": {
      "command": "python .github/scripts/validate_agent_docs.py truthfulness links --root .",
      "modes": [
        "truthfulness",
        "links"
      ],
      "exit_code": 0,
      "result": "passed"
    }
  },
  "human_review": {
    "summary": "Updated the quickstart's first-registration example to pass an invite code.",
    "rationale": "The baseline truthfulness and links validation flagged the bare register() call as a stale default. README.md documents first registration with an invite code; the quickstart now uses openforage.register(invite_code=\"<CODE>\"). The final validation of both modes passed."
  }
}
